### ISSUE TITLE
ERROR cncli::nodeclient::sync > find_intersect error!: ChannelError(NotConnected(None))

### ISSUE THREAD

**Issue by benapetr** [cardano-community/cncli#40]
**Describe the bug**
I get this error when running: cncli sync --no-service --host 127.0.0.1 --port 6000
(initial sync works OK, just follow-up sync doesn't work):

ERROR cncli::nodeclient::sync > find_intersect error!: ChannelError(NotConnected(None))

**To Reproduce**
Run cncli sync --no-service --host 127.0.0.1 --port 6000 after initial sync finishes with cardano-node 8.1.2 - linux-x86_64 - ghc-8.10

This used to work just fine with older versions of cardano-node

**Expected behavior**
Not crash with error

**Screenshots**

**Desktop (please complete the following information):**
 - OS: [e.g. iOS] Debian GNU/Linux 11 (bullseye)
 - Version [e.g. 22] cncli 5.3.2 (compiled from current master)

**Comment by rphair** [comment]
This is a duplicate of an issue that we still await an answer for: https://github.com/cardano-community/cncli/issues/25#issuecomment-1500484078

**Comment by arussell29** [comment]
Greetings,
In testing cardano-node 8.7.2, I have encountered the above error. I did not have any issues like this prior to 8.7.2 as the above posters did. I am using Ubuntu 22.04. I am running two relays, one on Mainnet and the other on Preview. Likewise, I am running two block producers, one on Mainnet and the other on Preview. The error only shows up for the block producers regardless of the network. I discovered that if I set enableP2P to TRUE in the configuration json for the block producers then I no longer have the error. I usually run the relay nodes with P2P on, so I never encountered the problem before. However, I always run the block producers in the non-P2P format since I understand that these should not contact or be contacted outside of your private network space.

So, the question in my mind is the following: Is this error evidence of a regression in cardano-node communication? Maybe, but why did it show up in earlier versions for the above posters, but not for me? Should I be configuring my block producer differently now? In other words, should I enable P2P on the block producer and then just limit the incoming nodes via firewall rules? Has IOG deprecated the non-P2P format? It seems that if there is a switch in the configuration to set P2P to disabled then the assumption is that it should be possible to configure the node to run this way.

In summary, I experience the ChannelError(NotConnected(None)) problem every couple minutes with cncli-sync. This causes a large use of virtual memory and heavy CPU usage. The node essentially cannot function properly if I continue to use CNCLI. The only workaround I know of is to use P2P mode on my block producer, which I currently am doing on the Preview network. For Mainnet, I currently have stopped CNCLI, but since that program is so valuable to my workflow, I likely will downgrade my cardano-node so I can continue using it.

Can anyone offer any insights on this issue? Is this a cardano-node problem, a cncli problem, or a node configuration issue? Does anyone have a solution?

**Comment by rphair** [comment]
I have found, since my https://github.com/cardano-community/cncli/issues/25#issuecomment-1650237680 which I said would be my final posting on this issue, that if `cncli` stops and restarts, it will not communicate with node `8.7.2` (and often with `8.1.2`), with the `find_intersect` error, _unless the node is also restarted_.

For our workflow, that means every restart of `cardano-node` must be done by rebooting the machine.  We could restart the 2 daemons in sequence but it makes more sense for us to spend 20 seconds rebooting.  It also means that, as previously reported, `cncli` effectively can't run in `--no-service` mode, as we previously reported in that other thread.

My decision not to post anymore about this issue was based on the original maintainer @AndrewWestberg's not engaging with either of these issues.  I am happy to have had this tool and to have used it for years in my own workflow, and certainly appreciate its development, but from my own perspective of working on open source projects for many years I would consider `cncli` to be ~~ummaintained~~ (**edit:** correction circa [release v6.0.0-alpha1](https://github.com/cardano-community/cncli/releases/tag/v6.0.0-alpha1)).

**Comment by arussell29** [comment]
It seems to me that Andrew did engage with the issue but could not reproduce the problem. Unless there is a wider engagement from the user base providing more information, it is very difficult to continue troubleshooting. It concerns me that since few others are acknowledging this problem that perhaps it's only a problem for a very few. I'm also not necessarily convinced that the problem is with cncli. It could be something else (?) This was the only forum where I found this problem discussed.

**Comment by rphair** [comment]
I don't think ultimately declaring "it's not a problem because it doesn't happen to me" (i.e. the developer) is really an engagement with the issue.

**Comment by petroars** [comment]
I have this issue on 8.7.2

**Comment by petroars** [comment]
Does v6.0.0-alpha1 solve this issue?

**Comment by AndrewWestberg** [comment]
Please re-test on the 6.0.0-alpha2 release.

**Comment by petroars** [comment]
> Please re-test on the 6.0.0-alpha2 release.

I am getting this error now.

2023-12-22T09:55:00.271211Z ERROR pallas_network::multiplexer: beaerer IO error err=Os { code: 104, kind: ConnectionReset, message: "Connection reset by peer" }
 2023-12-22T09:55:15.270Z ERROR cncli::nodeclient::sync > miniprotocol error: KeepAliveError(Plexer(AgentEnqueue(8, [130, 0, 25, 155, 217])))
 2023-12-22T09:55:15.270Z WARN  cncli::nodeclient::sync > Disconnected... retry in 5 secs...
2023-12-22T09:55:25.313561Z ERROR pallas_network::multiplexer: beaerer IO error err=Os { code: 104, kind: ConnectionReset, message: "Connection reset by peer" }
 2023-12-22T09:55:40.297Z ERROR cncli::nodeclient::sync > miniprotocol error: KeepAliveError(Plexer(AgentEnqueue(8, [130, 0, 25, 149, 44])))
 2023-12-22T09:55:40.297Z WARN  cncli::nodeclient::sync > Disconnected... retry in 5 secs...

**Comment by petroars** [comment]
ok, I deleted cncli.db again, I'll try to sync with new version to 100% and then try to restart. For now it restarts with no problem at 47%+ !

**Comment by petroars** [comment]
after sync to 100% and then restarting cncli I get this error. 

```
2023-12-22T15:46:47.200954Z ERROR pallas_network::multiplexer: beaerer IO error err=Os { code: 104, kind: ConnectionReset, message: "Connection reset by peer" }
 2023-12-22T15:47:02.201Z ERROR cncli::nodeclient::sync > miniprotocol error: KeepAliveError(Plexer(AgentEnqueue(8, [130, 0, 25, 113, 207])))
 2023-12-22T15:47:02.201Z WARN  cncli::nodeclient::sync > Disconnected... retry in 5 secs...
2023-12-22T15:47:12.224184Z ERROR pallas_network::multiplexer: beaerer IO error err=Os { code: 104, kind: ConnectionReset, message: "Connection reset by peer" }
 2023-12-22T15:47:27.223Z ERROR cncli::nodeclient::sync > miniprotocol error: KeepAliveError(Plexer(AgentEnqueue(8, [130, 0, 25, 139, 215])))
 2023-12-22T15:47:27.223Z WARN  cncli::nodeclient::sync > Disconnected... retry in 5 secs...
2023-12-22T15:47:37.280276Z ERROR pallas_network::multiplexer: beaerer IO error err=Os { code: 104, kind: ConnectionReset, message: "Connection reset by peer" }
 2023-12-22T15:47:52.244Z ERROR cncli::nodeclient::sync > miniprotocol error: KeepAliveError(Plexer(AgentEnqueue(8, [130, 0, 25, 228, 145])))
 2023-12-22T15:47:52.244Z WARN  cncli::nodeclient::sync > Disconnected... retry in 5 secs...
2023-12-22T15:48:02.263947Z ERROR pallas_network::multiplexer: beaerer IO error err=Os { code: 104, kind: ConnectionReset, message: "Connection reset by peer" }
 2023-12-22T15:48:17.263Z ERROR cncli::nodeclient::sync > miniprotocol error: KeepAliveError(Plexer(AgentEnqueue(8, [130, 0, 25, 57, 93])))
 2023-12-22T15:48:17.263Z WARN  cncli::nodeclient::sync > Disconnected... retry in 5 secs...
2023-12-22T15:48:27.297833Z ERROR pallas_network::multiplexer: beaerer IO error err=Os { code: 104, kind: ConnectionReset, message: "Connection reset by peer" }
 2023-12-22T15:48:42.284Z ERROR cncli::nodeclient::sync > miniprotocol error: KeepAliveError(Plexer(AgentEnqueue(8, [130, 0, 25, 247, 197])))
 2023-12-22T15:48:42.284Z WARN  cncli::nodeclient::sync > Disconnected... retry in 5 secs...
2023-12-22T15:48:52.312104Z ERROR pallas_network::multiplexer: beaerer IO error err=Os { code: 104, kind: ConnectionReset, message: "Connection reset by peer" }
 2023-12-22T15:49:07.303Z ERROR cncli::nodeclient::sync > miniprotocol error: KeepAliveError(Plexer(AgentEnqueue(8, [130, 0, 25, 31, 93])))
 2023-12-22T15:49:07.303Z WARN  cncli::nodeclient::sync > Disconnected... retry in 5 secs...
2023-12-22T15:49:17.352466Z ERROR pallas_network::multiplexer: beaerer IO error err=Os { code: 104, kind: ConnectionReset, message: "Connection reset by peer" }
 2023-12-22T15:49:32.323Z ERROR cncli::nodeclient::sync > miniprotocol error: KeepAliveError(Plexer(AgentEnqueue(8, [130, 0, 25, 245, 118])))
 2023-12-22T15:49:32.323Z WARN  cncli::nodeclient::sync > Disconnected... retry in 5 secs...
2023-12-22T15:49:42.342064Z ERROR pallas_network::multiplexer: beaerer IO error err=Os { code: 104, kind: ConnectionReset, message: "Connection reset by peer" }
 2023-12-22T15:49:57.341Z ERROR cncli::nodeclient::sync > miniprotocol error: KeepAliveError(Plexer(AgentEnqueue(8, [130, 0, 25, 154, 8])))
 2023-12-22T15:49:57.342Z WARN  cncli::nodeclient::sync > Disconnected... retry in 5 secs...
2023-12-22T15:50:07.368956Z ERROR pallas_network::multiplexer: beaerer IO error err=Os { code: 104, kind: ConnectionReset, message: "Connection reset by peer" }
 2023-12-22T15:50:22.362Z ERROR cncli::nodeclient::sync > miniprotocol error: KeepAliveError(Plexer(AgentEnqueue(8, [130, 0, 25, 145, 150])))
 2023-12-22T15:50:22.362Z WARN  cncli::nodeclient::sync > Disconnected... retry in 5 secs...
2023-12-22T15:50:32.403249Z ERROR pallas_network::multiplexer: beaerer IO error err=Os { code: 104, kind: ConnectionReset, message: "Connection reset by peer" }
 2023-12-22T15:50:47.381Z ERROR cncli::nodeclient::sync > miniprotocol error: KeepAliveError(Plexer(AgentEnqueue(8, [130, 0, 25, 64, 159])))
 2023-12-22T15:50:47.381Z WARN  cncli::nodeclient::sync > Disconnected... retry in 5 secs...
2023-12-22T15:50:57.400385Z ERROR pallas_network::multiplexer: beaerer IO error err=Os { code: 104, kind: ConnectionReset, message: "Connection reset by peer" }
 2023-12-22T15:51:12.401Z ERROR cncli::nodeclient::sync > miniprotocol error: KeepAliveError(Plexer(AgentEnqueue(8, [130, 0, 25, 153, 195])))
 2023-12-22T15:51:12.401Z WARN  cncli::nodeclient::sync > Disconnected... retry in 5 secs...
2023-12-22T15:51:22.421810Z ERROR pallas_network::multiplexer: beaerer IO error err=Os { code: 104, kind: ConnectionReset, message: "Connection reset by peer" }

```

**Comment by petroars** [comment]
I use P2P and its Ubuntu on ARM64

**Comment by AndrewWestberg** [comment]
@petroars Please try alpha3 now.

**Comment by petroars** [comment]
> @petroars Please try alpha3 now.

nope, sorry. Different error. Maybe I am compiling wrong? Thats starting from 100% sync. I ll do a full resync later. 
```
2023-12-23T19:20:10.536Z ERROR cncli::nodeclient::sync > miniprotocol error: KeepAliveError(Plexer(AgentDequeue))
 2023-12-23T19:20:10.540Z WARN  cncli::nodeclient::sync > Disconnected... retry in 5 secs...
 2023-12-23T19:20:35.548Z ERROR cncli::nodeclient::sync > miniprotocol error: KeepAliveError(Plexer(AgentDequeue))
 2023-12-23T19:20:35.548Z WARN  cncli::nodeclient::sync > Disconnected... retry in 5 secs...
 2023-12-23T19:21:00.555Z ERROR cncli::nodeclient::sync > miniprotocol error: KeepAliveError(Plexer(AgentDequeue))
 2023-12-23T19:21:00.555Z WARN  cncli::nodeclient::sync > Disconnected... retry in 5 secs...
 2023-12-23T19:21:25.561Z ERROR cncli::nodeclient::sync > miniprotocol error: KeepAliveError(Plexer(AgentDequeue))
 2023-12-23T19:21:25.561Z WARN  cncli::nodeclient::sync > Disconnected... retry in 5 secs...
```

**Comment by AndrewWestberg** [comment]
@petroars What exact version of cncli alpha3 are you running? Is the node you're connecting to local on the box, or remote? Are you still on cardano-node 8.7.2 or are you on 8.7.3 now?

**Comment by cardano-apexpool** [comment]
The same behavior as for @petroars, cardano-node 8.1.2:

```
 2023-12-26T15:07:14.026Z INFO  cncli::nodeclient::sync   > block 9716112 of 9723531: 99.92% sync'd
 2023-12-26T15:07:21.653Z INFO  cncli::nodeclient::sync   > block 9722201 of 9723531: 99.99% sync'd
 2023-12-26T15:07:23.346Z INFO  cncli::nodeclient::sync   > block 9723531 of 9723531: 100.00% sync'd
 2023-12-26T15:07:55.397Z INFO  cncli::nodeclient::sync   > block 9723532 of 9723532: 100.00% sync'd
 2023-12-26T15:08:03.451Z INFO  cncli::nodeclient::sync   > block 9723533 of 9723533: 100.00% sync'd
^C

$ /var/tmp/cncli sync --host 127.0.0.1 --port 5001 --db /home/cardano/cardano-node/cncli-db/cncli.db 
 2023-12-26T15:09:17.699Z ERROR cncli::nodeclient::sync > miniprotocol error: KeepAliveError(Plexer(AgentDequeue))
 2023-12-26T15:09:17.700Z WARN  cncli::nodeclient::sync > Disconnected... retry in 5 secs...
 2023-12-26T15:09:42.713Z ERROR cncli::nodeclient::sync > miniprotocol error: KeepAliveError(Plexer(AgentDequeue))
 2023-12-26T15:09:42.713Z WARN  cncli::nodeclient::sync > Disconnected... retry in 5 secs...
^C

$ RUST_BACKTRACE=1 /var/tmp/cncli sync --host 127.0.0.1 --port 5001 --db /home/cardano/cardano-node/cncli-db/cncli.db 
 2023-12-26T15:10:05.464Z ERROR cncli::nodeclient::sync > miniprotocol error: ChainSyncError(Plexer(AgentDequeue))
 2023-12-26T15:10:05.464Z WARN  cncli::nodeclient::sync > Disconnected... retry in 5 secs...
 2023-12-26T15:10:22.028Z ERROR cncli::nodeclient::sync > miniprotocol error: ChainSyncError(Plexer(AgentDequeue))
 2023-12-26T15:10:22.028Z WARN  cncli::nodeclient::sync > Disconnected... retry in 5 secs...
^C

$ RUST_BACKTRACE=full /var/tmp/cncli sync --host 127.0.0.1 --port 5001 --db /home/cardano/cardano-node/cncli-db/cncli.db 
 2023-12-26T15:10:43.173Z ERROR cncli::nodeclient::sync > miniprotocol error: ChainSyncError(Plexer(AgentDequeue))
 2023-12-26T15:10:43.173Z WARN  cncli::nodeclient::sync > Disconnected... retry in 5 secs...
 2023-12-26T15:10:59.571Z ERROR cncli::nodeclient::sync > miniprotocol error: ChainSyncError(Plexer(AgentDequeue))
 2023-12-26T15:10:59.571Z WARN  cncli::nodeclient::sync > Disconnected... retry in 5 secs...
^C

$ /var/tmp/cncli --version
cncli v6.0.0-alpha3 <e5b811e> (x86_64-unknown-linux-gnu)

$ cardano-node --version
cardano-node 8.7.2 - linux-x86_64 - ghc-8.10
git rev 30b6e447c7e4586f43e30a68fe47c8481b0ba205
```

**Comment by petroars** [comment]
> @petroars What exact version of cncli alpha3 are you running? Is the node you're connecting to local on the box, or remote? Are you still on cardano-node 8.7.2 or are you on 8.7.3 now?

cardano-node 8.7.2 - linux-aarch64 - ghc-9.6
git rev 30b6e447c7e4586f43e30a68fe47c8481b0ba205

cncli --version
cncli v6.0.0-alpha3 <e5b811e> (aarch64-unknown-linux-musl)

I usually run ./cncli sync --host 0.0.0.0 --port 6060 , but I also tried remote server, same effect. It connects from 0%, even at 47%+ you can restart, but somewhere further in sync it wont work. Maybe I ll try to find at what exact % it fails...

**Comment by AndrewWestberg** [comment]
@cardano-apexpool What operating system?

**Comment by AndrewWestberg** [comment]
@petroars I've never tested with cardano-node compiled with anything other than 8.10.7. Also never tested any of this on aarch. Can you try compiling cncli yourself?

```
cargo install --path . --force --target aarch64-unknown-linux-musl
```

**Comment by petroars** [comment]
> @petroars I've never tested with cardano-node compiled with anything other than 8.10.7. Also never tested any of this on aarch. Can you try compiling cncli yourself?
> 
> ```
> cargo install --path . --force --target aarch64-unknown-linux-musl
> ```

thats how I compile it every time.

**Comment by AndrewWestberg** [comment]
@petroars Try running with `RUST_LOG=trace cncli...` and see if we can't get more information about what is going wrong.

**Comment by cardano-apexpool** [comment]
@AndrewWestberg Debian 11.8.

```
$ RUST_LOG=trace /var/tmp/cncli sync --host 127.0.0.1 --port 5001 --db /home/cardano/cardano-node/cncli-db/cncli.db 
 2023-12-29T18:36:36.168Z DEBUG cncli::nodeclient::sqlite > Opening database
 2023-12-29T18:36:36.175Z DEBUG cncli::nodeclient::sqlite > Intialize database.
2023-12-29T18:36:36.179576Z TRACE pallas_network::multiplexer: waiting for segment header
2023-12-29T18:36:36.183826Z DEBUG pallas_network::miniprotocols::handshake::client: version proposed
2023-12-29T18:36:36.183186Z TRACE pallas_network::multiplexer: mux happening protocol=0
2023-12-29T18:36:36.184065Z TRACE pallas_network::multiplexer: write to bearer protocol=0 data="8200a707821a2d964a09f408821a2d964a09f409821a2d964a09f40a821a2d964a09f40b841a2d964a09f400f40c841a2d964a09f400f40d841a2d964a09f400f4"
2023-12-29T18:36:36.184226Z TRACE pallas_network::multiplexer: waiting for full segment
2023-12-29T18:36:36.184270Z TRACE pallas_network::multiplexer: demux happening protocol=32768
2023-12-29T18:36:36.184300Z TRACE pallas_network::multiplexer: waiting for segment header
2023-12-29T18:36:36.184498Z TRACE pallas_network::multiplexer: waiting for full message len=0
2023-12-29T18:36:36.185861Z DEBUG pallas_network::multiplexer: decoding done
2023-12-29T18:36:36.185890Z DEBUG pallas_network::miniprotocols::handshake::client: handshake accepted
 2023-12-29T18:36:36.186Z DEBUG cncli::nodeclient::sync   > keepalive process started!
 2023-12-29T18:36:56.190Z DEBUG cncli::nodeclient::sync   > sending keepalive...
2023-12-29T18:36:56.192899Z DEBUG pallas_network::miniprotocols::keepalive::client: sent keepalive message with cookie 36283
2023-12-29T18:36:56.192951Z TRACE pallas_network::multiplexer: waiting for full message len=0
 2023-12-29T18:36:56.193Z ERROR cncli::nodeclient::sync   > miniprotocol error: KeepAliveError(Plexer(AgentDequeue))
 2023-12-29T18:36:56.193Z WARN  cncli::nodeclient::sync   > Disconnected... retry in 5 secs...
2023-12-29T18:36:56.193051Z TRACE pallas_network::multiplexer: mux happening protocol=8
 2023-12-29T18:37:01.194Z DEBUG cncli::nodeclient::sqlite > Opening database
 2023-12-29T18:37:01.195Z DEBUG cncli::nodeclient::sqlite > Intialize database.
2023-12-29T18:37:01.197635Z TRACE pallas_network::multiplexer: waiting for segment header
2023-12-29T18:37:01.197661Z DEBUG pallas_network::miniprotocols::handshake::client: version proposed
2023-12-29T18:37:01.197705Z TRACE pallas_network::multiplexer: waiting for full message len=0
2023-12-29T18:37:01.197686Z TRACE pallas_network::multiplexer: mux happening protocol=0
2023-12-29T18:37:01.197881Z TRACE pallas_network::multiplexer: write to bearer protocol=0 data="8200a707821a2d964a09f408821a2d964a09f409821a2d964a09f40a821a2d964a09f40b841a2d964a09f400f40c841a2d964a09f400f40d841a2d964a09f400f4"
2023-12-29T18:37:01.198396Z TRACE pallas_network::multiplexer: waiting for full segment
2023-12-29T18:37:01.198430Z TRACE pallas_network::multiplexer: demux happening protocol=32768
2023-12-29T18:37:01.198466Z TRACE pallas_network::multiplexer: waiting for segment header
2023-12-29T18:37:01.198516Z DEBUG pallas_network::multiplexer: decoding done
2023-12-29T18:37:01.198545Z DEBUG pallas_network::miniprotocols::handshake::client: handshake accepted
 2023-12-29T18:37:01.198Z DEBUG cncli::nodeclient::sync   > keepalive process started!
 2023-12-29T18:37:21.200Z DEBUG cncli::nodeclient::sync   > sending keepalive...
2023-12-29T18:37:21.200712Z DEBUG pallas_network::miniprotocols::keepalive::client: sent keepalive message with cookie 27616
2023-12-29T18:37:21.200758Z TRACE pallas_network::multiplexer: waiting for full message len=0
2023-12-29T18:37:21.200880Z TRACE pallas_network::multiplexer: mux happening protocol=8
 2023-12-29T18:37:21.200Z ERROR cncli::nodeclient::sync   > miniprotocol error: KeepAliveError(Plexer(AgentDequeue))
 2023-12-29T18:37:21.200Z WARN  cncli::nodeclient::sync   > Disconnected... retry in 5 secs...
 2023-12-29T18:37:26.202Z DEBUG cncli::nodeclient::sqlite > Opening database
 2023-12-29T18:37:26.203Z DEBUG cncli::nodeclient::sqlite > Intialize database.
2023-12-29T18:37:26.205010Z TRACE pallas_network::multiplexer: waiting for segment header
2023-12-29T18:37:26.205010Z DEBUG pallas_network::miniprotocols::handshake::client: version proposed
2023-12-29T18:37:26.205092Z TRACE pallas_network::multiplexer: waiting for full message len=0
2023-12-29T18:37:26.205110Z TRACE pallas_network::multiplexer: mux happening protocol=0
2023-12-29T18:37:26.205263Z TRACE pallas_network::multiplexer: write to bearer protocol=0 data="8200a707821a2d964a09f408821a2d964a09f409821a2d964a09f40a821a2d964a09f40b841a2d964a09f400f40c841a2d964a09f400f40d841a2d964a09f400f4"
2023-12-29T18:37:26.205406Z TRACE pallas_network::multiplexer: waiting for full segment
2023-12-29T18:37:26.205437Z TRACE pallas_network::multiplexer: demux happening protocol=32768
2023-12-29T18:37:26.205474Z TRACE pallas_network::multiplexer: waiting for segment header
2023-12-29T18:37:26.207318Z DEBUG pallas_network::multiplexer: decoding done
2023-12-29T18:37:26.207353Z DEBUG pallas_network::miniprotocols::handshake::client: handshake accepted
 2023-12-29T18:37:26.207Z DEBUG cncli::nodeclient::sync   > keepalive process started!
2023-12-29T18:37:39.341572Z DEBUG pallas_network::miniprotocols::chainsync::client: send find intersect
2023-12-29T18:37:39.341913Z DEBUG pallas_network::miniprotocols::chainsync::client: waiting for intersect response
2023-12-29T18:37:39.341941Z TRACE pallas_network::multiplexer: waiting for full message len=0
2023-12-29T18:37:39.342937Z TRACE pallas_network::multiplexer: mux happening protocol=2
 2023-12-29T18:37:39.342Z ERROR cncli::nodeclient::sync   > miniprotocol error: ChainSyncError(Plexer(AgentDequeue))
 2023-12-29T18:37:39.343Z WARN  cncli::nodeclient::sync   > Disconnected... retry in 5 secs...
^C
```

**Comment by petroars** [comment]
cardano@oracle:/mypool$ sudo RUST_LOG=trace ./cncli sync --host 0.0.0.0 --port 6060
 2023-12-29T18:42:51.295Z DEBUG cncli::nodeclient::sqlite > Opening database
 2023-12-29T18:42:51.307Z DEBUG cncli::nodeclient::sqlite > Intialize database.
2023-12-29T18:42:51.315318Z TRACE pallas_network::multiplexer: waiting for segment header
2023-12-29T18:42:51.315333Z DEBUG pallas_network::miniprotocols::handshake::client: version proposed
2023-12-29T18:42:51.315343Z TRACE pallas_network::multiplexer: mux happening protocol=0
2023-12-29T18:42:51.316641Z TRACE pallas_network::multiplexer: write to bearer protocol=0 data="8200a707821a2d964a09f408821a2d964a09f409821a2d964a09f40a821a2d964a09f40b841a2d964a09f400f40c841a2d964a09f400f40d841a2d964a09f400f4"
2023-12-29T18:42:51.316284Z TRACE pallas_network::multiplexer: waiting for full message len=0
2023-12-29T18:42:51.316999Z TRACE pallas_network::multiplexer: waiting for full segment
2023-12-29T18:42:51.317029Z TRACE pallas_network::multiplexer: demux happening protocol=32768
2023-12-29T18:42:51.317041Z TRACE pallas_network::multiplexer: waiting for segment header
2023-12-29T18:42:51.317231Z DEBUG pallas_network::multiplexer: decoding done
2023-12-29T18:42:51.317244Z DEBUG pallas_network::miniprotocols::handshake::client: handshake accepted
 2023-12-29T18:42:51.317Z DEBUG cncli::nodeclient::sync   > keepalive process started!
 2023-12-29T18:43:11.318Z DEBUG cncli::nodeclient::sync   > sending keepalive...
2023-12-29T18:43:11.318386Z DEBUG pallas_network::miniprotocols::keepalive::client: sent keepalive message with cookie 4331
2023-12-29T18:43:11.318402Z TRACE pallas_network::multiplexer: waiting for full message len=0
2023-12-29T18:43:11.318491Z TRACE pallas_network::multiplexer: mux happening protocol=8
 2023-12-29T18:43:11.318Z ERROR cncli::nodeclient::sync   > miniprotocol error: KeepAliveError(Plexer(AgentDequeue))
 2023-12-29T18:43:11.318Z WARN  cncli::nodeclient::sync   > Disconnected... retry in 5 secs...
 2023-12-29T18:43:16.320Z DEBUG cncli::nodeclient::sqlite > Opening database
 2023-12-29T18:43:16.322Z DEBUG cncli::nodeclient::sqlite > Intialize database.
2023-12-29T18:43:16.325033Z DEBUG pallas_network::miniprotocols::handshake::client: version proposed
2023-12-29T18:43:16.325049Z TRACE pallas_network::multiplexer: waiting for full message len=0
2023-12-29T18:43:16.325065Z TRACE pallas_network::multiplexer: waiting for segment header
2023-12-29T18:43:16.325071Z TRACE pallas_network::multiplexer: mux happening protocol=0
2023-12-29T18:43:16.325115Z TRACE pallas_network::multiplexer: write to bearer protocol=0 data="8200a707821a2d964a09f408821a2d964a09f409821a2d964a09f40a821a2d964a09f40b841a2d964a09f400f40c841a2d964a09f400f40d841a2d964a09f400f4"
2023-12-29T18:43:16.325840Z TRACE pallas_network::multiplexer: waiting for full segment
2023-12-29T18:43:16.325876Z TRACE pallas_network::multiplexer: demux happening protocol=32768
2023-12-29T18:43:16.325893Z TRACE pallas_network::multiplexer: waiting for segment header
2023-12-29T18:43:16.325933Z DEBUG pallas_network::multiplexer: decoding done
2023-12-29T18:43:16.325950Z DEBUG pallas_network::miniprotocols::handshake::client: handshake accepted
 2023-12-29T18:43:16.328Z DEBUG cncli::nodeclient::sync   > keepalive process started!
 2023-12-29T18:43:36.328Z DEBUG cncli::nodeclient::sync   > sending keepalive...
2023-12-29T18:43:36.328813Z DEBUG pallas_network::miniprotocols::keepalive::client: sent keepalive message with cookie 14872
2023-12-29T18:43:36.328830Z TRACE pallas_network::multiplexer: waiting for full message len=0
2023-12-29T18:43:36.328851Z TRACE pallas_network::multiplexer: mux happening protocol=8
 2023-12-29T18:43:36.328Z ERROR cncli::nodeclient::sync   > miniprotocol error: KeepAliveError(Plexer(AgentDequeue))
 2023-12-29T18:43:36.328Z WARN  cncli::nodeclient::sync   > Disconnected... retry in 5 secs...
 2023-12-29T18:43:41.330Z DEBUG cncli::nodeclient::sqlite > Opening database
 2023-12-29T18:43:41.331Z DEBUG cncli::nodeclient::sqlite > Intialize database.
2023-12-29T18:43:41.333729Z DEBUG pallas_network::miniprotocols::handshake::client: version proposed
2023-12-29T18:43:41.334096Z TRACE pallas_network::multiplexer: waiting for full message len=0
2023-12-29T18:43:41.333777Z TRACE pallas_network::multiplexer: mux happening protocol=0
2023-12-29T18:43:41.334202Z TRACE pallas_network::multiplexer: write to bearer protocol=0 data="8200a707821a2d964a09f408821a2d964a09f409821a2d964a09f40a821a2d964a09f40b841a2d964a09f400f40c841a2d964a09f400f40d841a2d964a09f400f4"
2023-12-29T18:43:41.333751Z TRACE pallas_network::multiplexer: waiting for segment header
2023-12-29T18:43:41.334800Z TRACE pallas_network::multiplexer: waiting for full segment
2023-12-29T18:43:41.334808Z TRACE pallas_network::multiplexer: demux happening protocol=32768
2023-12-29T18:43:41.334819Z TRACE pallas_network::multiplexer: waiting for segment header
2023-12-29T18:43:41.334833Z DEBUG pallas_network::multiplexer: decoding done
2023-12-29T18:43:41.335192Z DEBUG pallas_network::miniprotocols::handshake::client: handshake accepted
 2023-12-29T18:43:41.336Z DEBUG cncli::nodeclient::sync   > keepalive process started!

**Comment by AndrewWestberg** [comment]
From what I can see, the node is actually rejecting the keep-alive miniprotocol messages. Can you both look in the cardano-node logs and see what messages you get when you have TraceMux and TraceHandshake set to true.

**Comment by petroars** [comment]
> From what I can see, the node is actually rejecting the keep-alive miniprotocol messages. Can you both look in the cardano-node logs and see what messages you get when you have TraceMux and TraceHandshake set to true.

Is that the part?

`Dec 29 22:22:55 oracle cardano-node[160263]: [oracle:cardano.node.ConnectionManager:Info:997] [2023-12-29 21:22:55.39 UTC] TrConnectionManagerCounters (ConnectionManagerCounters {fullDuplexConns = 0, duplexConns = 23, unidirectionalConns = 12, inboundConns = 6, outboundConns = 30})
Dec 29 22:22:55 oracle cardano-node[160263]: [oracle:cardano.node.Handshake:Info:998] [2023-12-29 21:22:55.39 UTC] WithMuxBearer (ConnectionId {localAddress = 127.0.0.1:6060, remoteAddress = 127.0.0.1:49224}) Recv (ClientAgency TokPropose,MsgProposeVersions (fromList [(NodeToNodeV_7,TList [TInt 764824073,TBool False]),(NodeToNodeV_8,TList [TInt 764824073,TBool False]),(NodeToNodeV_9,TList [TInt 764824073,TBool False]),(NodeToNodeV_10,TList [TInt 764824073,TBool False]),(NodeToNodeV_11,TList [TInt 764824073,TBool False,TInt 0,TBool False]),(NodeToNodeV_12,TList [TInt 764824073,TBool False,TInt 0,TBool False]),(NodeToNodeV_13,TList [TInt 764824073,TBool False,TInt 0,TBool False])]))
Dec 29 22:22:55 oracle cardano-node[160263]: [oracle:cardano.node.Handshake:Info:998] [2023-12-29 21:22:55.39 UTC] WithMuxBearer (ConnectionId {localAddress = 127.0.0.1:6060, remoteAddress = 127.0.0.1:49224}) Send (ServerAgency TokConfirm,MsgAcceptVersion NodeToNodeV_11 (TList [TInt 764824073,TBool False,TInt 0,TBool False]))
Dec 29 22:22:55 oracle cardano-node[160263]: [oracle:cardano.node.ConnectionManager:Info:998] [2023-12-29 21:22:55.39 UTC] TrConnectionHandler (ConnectionId {localAddress = 127.0.0.1:6060, remoteAddress = 127.0.0.1:49224}) (TrHandshakeSuccess NodeToNodeV_11 (NodeToNodeVersionData {networkMagic = NetworkMagic {unNetworkMagic = 764824073}, diffusionMode = InitiatorAndResponderDiffusionMode, peerSharing = PeerSharingDisabled, query = False}))
Dec 29 22:22:55 oracle cardano-node[160263]: [oracle:cardano.node.ConnectionManager:Info:997] [2023-12-29 21:22:55.39 UTC] TrConnectionManagerCounters (ConnectionManagerCounters {fullDuplexConns = 0, duplexConns = 24, unidirectionalConns = 12, inboundConns = 6, outboundConns = 30})
Dec 29 22:22:55 oracle cardano-node[160263]: [oracle:cardano.node.Mux:Info:998] [2023-12-29 21:22:55.39 UTC] Bearer on ConnectionId {localAddress = 127.0.0.1:6060, remoteAddress = 127.0.0.1:49224} event: State: Mature
Dec 29 22:22:55 oracle cardano-node[160263]: [oracle:cardano.node.Mux:Info:998] [2023-12-29 21:22:55.39 UTC] Bearer on ConnectionId {localAddress = 127.0.0.1:6060, remoteAddress = 127.0.0.1:49224} event: Started on demand (MiniProtocolNum 2) in ResponderDir
Dec 29 22:22:55 oracle cardano-node[160263]: [oracle:cardano.node.Mux:Info:998] [2023-12-29 21:22:55.39 UTC] Bearer on ConnectionId {localAddress = 127.0.0.1:6060, remoteAddress = 127.0.0.1:49224} event: Started on demand (MiniProtocolNum 3) in ResponderDir
Dec 29 22:22:55 oracle cardano-node[160263]: [oracle:cardano.node.Mux:Info:998] [2023-12-29 21:22:55.39 UTC] Bearer on ConnectionId {localAddress = 127.0.0.1:6060, remoteAddress = 127.0.0.1:49224} event: Started on demand (MiniProtocolNum 4) in ResponderDir
Dec 29 22:22:55 oracle cardano-node[160263]: [oracle:cardano.node.Mux:Info:998] [2023-12-29 21:22:55.39 UTC] Bearer on ConnectionId {localAddress = 127.0.0.1:6060, remoteAddress = 127.0.0.1:49224} event: Started on demand (MiniProtocolNum 8) in ResponderDir`

**Comment by petroars** [comment]
I actually don't see any errors in cardano-node logs during the time error in CNCLI happens. 

`Dec 29 22:39:05 oracle cncli[156859]:  2023-12-29T21:39:05.732Z ERROR cncli::nodeclient::sync > miniprotocol error: KeepAliveError(Plexer(AgentDequeue))
Dec 29 22:39:05 oracle cncli[156859]:  2023-12-29T21:39:05.732Z WARN  cncli::nodeclient::sync > Disconnected... retry in 5 secs...
`

`Dec 29 22:39:04 oracle cardano-node[160263]: [oracle:cardano.node.LeadershipCheck:Info:280] [2023-12-29 21:39:04.00 UTC] {"chainDensity":4.9780954e-2,"credentials":"Cardano","delegMapSize":1328133,"kind":"TraceStartLeadershipCheck","slot":112319653,"utxoSize":10696871}
Dec 29 22:39:04 oracle cardano-node[160263]: [oracle:cardano.node.Forge:Info:280] [2023-12-29 21:39:04.04 UTC] fromList [("credentials",String "Cardano"),("val",Object (fromList [("kind",String "TraceNodeNotLeader"),("slot",Number 1.12319653e8)]))]
Dec 29 22:39:05 oracle cardano-node[160263]: [oracle:cardano.node.LeadershipCheck:Info:280] [2023-12-29 21:39:05.00 UTC] {"chainDensity":4.9780954e-2,"credentials":"Cardano","delegMapSize":1328133,"kind":"TraceStartLeadershipCheck","slot":112319654,"utxoSize":10696871}
Dec 29 22:39:05 oracle cardano-node[160263]: [oracle:cardano.node.Forge:Info:280] [2023-12-29 21:39:05.04 UTC] fromList [("credentials",String "Cardano"),("val",Object (fromList [("kind",String "TraceNodeNotLeader"),("slot",Number 1.12319654e8)]))]
Dec 29 22:39:06 oracle cardano-node[160263]: [oracle:cardano.node.LeadershipCheck:Info:280] [2023-12-29 21:39:06.00 UTC] {"chainDensity":4.9780954e-2,"credentials":"Cardano","delegMapSize":1328133,"kind":"TraceStartLeadershipCheck","slot":112319655,"utxoSize":10696871}
Dec 29 22:39:06 oracle cardano-node[160263]: [oracle:cardano.node.Forge:Info:280] [2023-12-29 21:39:06.04 UTC] fromList [("credentials",String "Cardano"),("val",Object (fromList [("kind",String "TraceNodeNotLeader"),("slot",Number 1.12319655e8)]))]
Dec 29 22:39:07 oracle cardano-node[160263]: [oracle:cardano.node.LeadershipCheck:Info:280] [2023-12-29 21:39:07.00 UTC] {"chainDensity":4.9780954e-2,"credentials":"Cardano","delegMapSize":1328133,"kind":"TraceStartLeadershipCheck","slot":112319656,"utxoSize":10696871}
Dec 29 22:39:07 oracle cardano-node[160263]: [oracle:cardano.node.Forge:Info:280] [2023-12-29 21:39:07.05 UTC] fromList [("credentials",String "Cardano"),("val",Object (fromList [("kind",String "TraceNodeNotLeader"),("slot",Number 1.12319656e8)]))]`

**Comment by AndrewWestberg** [comment]
@petroars Try connecting to 127.0.0.1 for the host. You can't connect to 0.0.0.0. That's only on the server side for listening.

**Comment by AndrewWestberg** [comment]
@cardano-apexpool Did you build cncli yourself or are you using a binary?

**Comment by cardano-apexpool** [comment]
@AndrewWestberg  I built it myself, on the same machine where I'm usually building it and where I'm also building cardano-node and mithril. 
I usually used `cargo install --path . --force`, this time I also used `cargo build` (like for mithril), but the errors are the same.

The cardano-node logs messages are:

```
[relay2:cardano.node.ConnectionManager:Info:1027290] [2023-12-30 08:27:51.46 UTC] TrConnectionHandler (ConnectionId {localAddress = 127.0.0.1:5001, remoteAddress = 127.0.0.1:40858}) (TrHandshakeSuccess NodeToNodeV_11 (NodeToNodeVersionData {networkMagic = NetworkMagic {unNetworkMagic = 764824073}, diffusionMode = InitiatorAndResponderDiffusionMode, peerSharing = PeerSharingDisabled, query = False}))
[relay2:cardano.node.InboundGovernor:Info:590] [2023-12-30 08:27:56.46 UTC] TrDemotedToColdRemote (ConnectionId {localAddress = 127.0.0.1:5001, remoteAddress = 127.0.0.1:40858}) (OperationSuccess CommitTr)
[relay2:cardano.node.ConnectionManager:Info:1027311] [2023-12-30 08:28:03.91 UTC] TrConnectionHandler (ConnectionId {localAddress = 127.0.0.1:5001, remoteAddress = 127.0.0.1:44836}) (TrHandshakeSuccess NodeToNodeV_11 (NodeToNodeVersionData {networkMagic = NetworkMagic {unNetworkMagic = 764824073}, diffusionMode = InitiatorAndResponderDiffusionMode, peerSharing = PeerSharingDisabled, query = False}))
[relay2:cardano.node.InboundGovernor:Info:590] [2023-12-30 08:28:08.91 UTC] TrDemotedToColdRemote (ConnectionId {localAddress = 127.0.0.1:5001, remoteAddress = 127.0.0.1:44836}) (OperationSuccess CommitTr)
[relay2:cardano.node.ConnectionManager:Info:1027331] [2023-12-30 08:28:16.26 UTC] TrConnectionHandler (ConnectionId {localAddress = 127.0.0.1:5001, remoteAddress = 127.0.0.1:60164}) (TrHandshakeSuccess NodeToNodeV_11 (NodeToNodeVersionData {networkMagic = NetworkMagic {unNetworkMagic = 764824073}, diffusionMode = InitiatorAndResponderDiffusionMode, peerSharing = PeerSharingDisabled, query = False}))
[relay2:cardano.node.InboundGovernor:Info:590] [2023-12-30 08:28:21.27 UTC] TrDemotedToColdRemote (ConnectionId {localAddress = 127.0.0.1:5001, remoteAddress = 127.0.0.1:60164}) (OperationSuccess CommitTr)
```

**Comment by petroars** [comment]
> @petroars Try connecting to 127.0.0.1 for the host. You can't connect to 0.0.0.0. That's only on the server side for listening.

it had no trouble connecting with 0.0.0.0 when sync is 0%. It is the same with 127.0.0.1 . And I don't see any errors in Cardano-node logs, maybe I need to enable some other log settings in config.json?

`Dec 30 11:12:30 oracle cardano-node[160263]: [oracle:cardano.node.ConnectionManager:Info:22196] [2023-12-30 10:12:30.57 UTC] TrConnectionManagerCounters (ConnectionManagerCounters {fullDuplexConns = 0, duplexConns = 44, unidirectionalConns = 16, inboundConns = 31, outboundConns = 30})
Dec 30 11:12:30 oracle cardano-node[160263]: [oracle:cardano.node.Handshake:Info:22197] [2023-12-30 10:12:30.57 UTC] WithMuxBearer (ConnectionId {localAddress = 127.0.0.1:6060, remoteAddress = 127.0.0.1:57280}) Recv (ClientAgency TokPropose,MsgProposeVersions (fromList [(NodeToNodeV_7,TList [TInt 764824073,TBool False]),(NodeToNodeV_8,TList [TInt 764824073,TBool False]),(NodeToNodeV_9,TList [TInt 764824073,TBool False]),(NodeToNodeV_10,TList [TInt 764824073,TBool False]),(NodeToNodeV_11,TList [TInt 764824073,TBool False,TInt 0,TBool False]),(NodeToNodeV_12,TList [TInt 764824073,TBool False,TInt 0,TBool False]),(NodeToNodeV_13,TList [TInt 764824073,TBool False,TInt 0,TBool False])]))
Dec 30 11:12:30 oracle cardano-node[160263]: [oracle:cardano.node.Handshake:Info:22197] [2023-12-30 10:12:30.57 UTC] WithMuxBearer (ConnectionId {localAddress = 127.0.0.1:6060, remoteAddress = 127.0.0.1:57280}) Send (ServerAgency TokConfirm,MsgAcceptVersion NodeToNodeV_11 (TList [TInt 764824073,TBool False,TInt 0,TBool False]))
Dec 30 11:12:30 oracle cardano-node[160263]: [oracle:cardano.node.ConnectionManager:Info:22197] [2023-12-30 10:12:30.57 UTC] TrConnectionHandler (ConnectionId {localAddress = 127.0.0.1:6060, remoteAddress = 127.0.0.1:57280}) (TrHandshakeSuccess NodeToNodeV_11 (NodeToNodeVersionData {networkMagic = NetworkMagic {unNetworkMagic = 764824073}, diffusionMode = InitiatorAndResponderDiffusionMode, peerSharing = PeerSharingDisabled, query = False}))
Dec 30 11:12:30 oracle cardano-node[160263]: [oracle:cardano.node.ConnectionManager:Info:22196] [2023-12-30 10:12:30.57 UTC] TrConnectionManagerCounters (ConnectionManagerCounters {fullDuplexConns = 0, duplexConns = 45, unidirectionalConns = 16, inboundConns = 31, outboundConns = 30})
Dec 30 11:12:30 oracle cardano-node[160263]: [oracle:cardano.node.Mux:Info:22197] [2023-12-30 10:12:30.57 UTC] Bearer on ConnectionId {localAddress = 127.0.0.1:6060, remoteAddress = 127.0.0.1:57280} event: State: Mature`

**Comment by AndrewWestberg** [comment]
@cardano-apexpool Something in your topology.json or config.json for p2p settings is preventing cncli from communicating by demoting the peer connection to cold.

**Comment by petroars** [comment]
I have very standard configs, only P2P enabled.

topology.json

`{
  "localRoots": [
    {
      "accessPoints": [],
      "advertise": false,
      "valency": 1
    }
  ],
  "publicRoots": [
    {
      "accessPoints": [
        {
          "address": "backbone.cardano.iog.io",
          "port": 3001
        }
      ],
      "advertise": false
    },
    {
      "accessPoints": [
        {
          "address": "backbone.cardano-mainnet.iohk.io",
          "port": 3001
        }
      ],
      "advertise": false
    },
    {
      "accessPoints": [
        {
          "address": "backbone.mainnet.emurgornd.com",
          "port": 3001
        }
      ],
      "advertise": false
    }
  ],
  "useLedgerAfterSlot": 99532743
}
`

config.json

`{
  "AlonzoGenesisFile": "alonzo-genesis.json",
  "AlonzoGenesisHash": "7e94a15f55d1e82d10f09203fa1d40f8eede58fd8066542cf6566008068ed874",
  "ByronGenesisFile": "byron-genesis.json",
  "ByronGenesisHash": "5f20df933584822601f9e3f8c024eb5eb252fe8cefb24d1317dc3d432e940ebb",
  "ConwayGenesisFile": "conway-genesis.json",
  "ConwayGenesisHash": "f7d46bdd3b3c8caf38351c4eef3346a89241707270be0d6106e8a407db294cc6",
  "EnableP2P": true,
  "LastKnownBlockVersion-Alt": 0,
  "LastKnownBlockVersion-Major": 3,
  "LastKnownBlockVersion-Minor": 0,
  "MaxKnownMajorProtocolVersion": 2,
  "Protocol": "Cardano",
  "RequiresNetworkMagic": "RequiresNoMagic",
  "ShelleyGenesisFile": "shelley-genesis.json",
  "ShelleyGenesisHash": "1a3be38bcbb7911969283716ad7aa550250226b76a61fc51cc9a9a35d9276d81",
  "TargetNumberOfActivePeers": 10,
  "TargetNumberOfEstablishedPeers": 20,
  "TargetNumberOfKnownPeers": 50,
  "TargetNumberOfRootPeers": 50,
  "TraceAcceptPolicy": true,
  "TraceBlockFetchClient": false,
  "TraceBlockFetchDecisions": false,
  "TraceBlockFetchProtocol": false,
  "TraceBlockFetchProtocolSerialised": false,
  "TraceBlockFetchServer": false,
  "TraceChainDb": true,
  "TraceChainSyncBlockServer": false,
  "TraceChainSyncClient": false,
  "TraceChainSyncHeaderServer": false,
  "TraceChainSyncProtocol": false,
  "TraceConnectionManager": true,
  "TraceDNSResolver": false,
  "TraceDNSSubscription": false,
  "TraceDiffusionInitialization": false,
  "TraceErrorPolicy": false,
  "TraceForge": true,
  "TraceHandshake": true,
  "TraceInboundGovernor": false,
  "TraceIpSubscription": false,
  "TraceLedgerPeers": false,
  "TraceLocalChainSyncProtocol": false,
  "TraceLocalConnectionManager": false,
  "TraceLocalErrorPolicy": false,
  "TraceLocalHandshake": false,
  "TraceLocalRootPeers": false,
  "TraceLocalTxSubmissionProtocol": false,
  "TraceLocalTxSubmissionServer": false,
  "TraceMempool": false,
  "TraceMux": true,
  "TracePeerSelection": false,
  "TracePeerSelectionActions": false,
  "TracePublicRootPeers": false,
  "TraceServer": true,
  "TraceTxInbound": false,
  "TraceTxOutbound": false,
  "TraceTxSubmissionProtocol": false,
  "TracingVerbosity": "NormalVerbosity",
  "TurnOnLogMetrics": true,
  "TurnOnLogging": true,
  "defaultBackends": [
    "KatipBK"
  ],
  "defaultScribes": [
    [
      "StdoutSK",
      "stdout"
    ]
  ],
  "hasEKG": 12788,
  "hasPrometheus": [
    "127.0.0.1",
    12798
  ],
  "minSeverity": "Info",
  "options": {
    "mapBackends": {
      "cardano.node.metrics": [
        "EKGViewBK"
      ],
      "cardano.node.resources": [
        "EKGViewBK"
      ]
    },
    "mapSubtrace": {
      "cardano.node.metrics": {
        "subtrace": "Neutral"
      }
    }
  },
  "rotation": {
    "rpKeepFilesNum": 10,
    "rpLogLimitBytes": 5000000,
    "rpMaxAgeHours": 24
  },
  "setupBackends": [
    "KatipBK"
  ],
  "setupScribes": [
    {
      "scFormat": "ScText",
      "scKind": "StdoutSK",
      "scName": "stdout",
      "scRotation": null
    }
  ]
}
`

**Comment by AndrewWestberg** [comment]
@cardano-apexpool jump over to discord DM please.

**Comment by AndrewWestberg** [comment]
Can you guys do a capture of the network traffic? Port is of course the port your cardano-node is listening on.

```
tcpdump -ni lo port 5001 -w /tmp/cncli.pcap
```

**Comment by petroars** [comment]
> Can you guys do a capture of the network traffic? Port is of course the port your cardano-node is listening on.
> 
> ```
> tcpdump -ni lo port 5001 -w /tmp/cncli.pcap
> ```

That was captured during cncli error

sudo ./cncli sync --host 127.0.0.1 --port 6060
 2024-01-02T14:41:07.102Z ERROR cncli::nodeclient::sync > miniprotocol error: KeepAliveError(Plexer(AgentDequeue))
 2024-01-02T14:41:07.102Z WARN  cncli::nodeclient::sync > Disconnected... retry in 5 secs...

cardano@oracle:/mypool$ sudo tcpdump -r /tmp/cncli.pcap
reading from file /tmp/cncli.pcap, link-type EN10MB (Ethernet), snapshot length 262144
15:40:40.133509 IP localhost.53116 > localhost.6060: Flags [P.], seq 3228600574:3228600582, ack 2989168250, win 10229, options [nop,nop,TS val 923840683 ecr 923822392], length 8
15:40:40.133541 IP localhost.53116 > localhost.6060: Flags [P.], seq 8:13, ack 1, win 10229, options [nop,nop,TS val 923840683 ecr 923822392], length 5
15:40:40.133717 IP localhost.6060 > localhost.53116: Flags [.], ack 13, win 512, options [nop,nop,TS val 923840683 ecr 923840683], length 0
15:40:40.133871 IP localhost.6060 > localhost.53116: Flags [P.], seq 1:14, ack 13, win 512, options [nop,nop,TS val 923840683 ecr 923840683], length 13
15:40:40.133884 IP localhost.53116 > localhost.6060: Flags [.], ack 14, win 10229, options [nop,nop,TS val 923840684 ecr 923840683], length 0
15:40:44.765587 IP localhost.6060 > localhost.53116: Flags [P.], seq 14:936, ack 13, win 512, options [nop,nop,TS val 923845315 ecr 923840684], length 922
15:40:44.765688 IP localhost.53116 > localhost.6060: Flags [.], ack 936, win 10229, options [nop,nop,TS val 923845315 ecr 923845315], length 0
15:40:45.383303 IP localhost.53116 > localhost.6060: Flags [P.], seq 13:21, ack 936, win 10229, options [nop,nop,TS val 923845933 ecr 923845315], length 8
15:40:45.383329 IP localhost.53116 > localhost.6060: Flags [P.], seq 21:23, ack 936, win 10229, options [nop,nop,TS val 923845933 ecr 923845315], length 2
15:40:45.383739 IP localhost.6060 > localhost.53116: Flags [.], ack 23, win 512, options [nop,nop,TS val 923845933 ecr 923845933], length 0
15:40:45.384052 IP localhost.6060 > localhost.53116: Flags [P.], seq 936:946, ack 23, win 512, options [nop,nop,TS val 923845934 ecr 923845933], length 10
15:40:45.384066 IP localhost.53116 > localhost.6060: Flags [.], ack 946, win 10229, options [nop,nop,TS val 923845934 ecr 923845934], length 0
15:40:47.030724 IP localhost.33968 > localhost.6060: Flags [S], seq 3541837319, win 65495, options [mss 65495,sackOK,TS val 923847580 ecr 0,nop,wscale 7], length 0
15:40:47.030744 IP localhost.6060 > localhost.33968: Flags [S.], seq 1255577206, ack 3541837320, win 65483, options [mss 65495,sackOK,TS val 923847580 ecr 923847580,nop,wscale 7], length 0
15:40:47.030757 IP localhost.33968 > localhost.6060: Flags [.], ack 1, win 512, options [nop,nop,TS val 923847580 ecr 923847580], length 0
15:40:47.030900 IP localhost.33968 > localhost.6060: Flags [P.], seq 1:9, ack 1, win 512, options [nop,nop,TS val 923847581 ecr 923847580], length 8
15:40:47.030905 IP localhost.6060 > localhost.33968: Flags [.], ack 9, win 512, options [nop,nop,TS val 923847581 ecr 923847581], length 0
15:40:47.030912 IP localhost.33968 > localhost.6060: Flags [P.], seq 9:74, ack 1, win 512, options [nop,nop,TS val 923847581 ecr 923847581], length 65
15:40:47.030916 IP localhost.6060 > localhost.33968: Flags [.], ack 74, win 512, options [nop,nop,TS val 923847581 ecr 923847581], length 0
15:40:47.077926 IP localhost.6060 > localhost.33968: Flags [P.], seq 1:21, ack 74, win 512, options [nop,nop,TS val 923847628 ecr 923847581], length 20
15:40:47.077947 IP localhost.33968 > localhost.6060: Flags [.], ack 21, win 512, options [nop,nop,TS val 923847628 ecr 923847628], length 0
15:40:52.214491 IP localhost.6060 > localhost.33968: Flags [R.], seq 21, ack 74, win 512, options [nop,nop,TS val 923852764 ecr 923847628], length 0
15:41:00.135185 IP localhost.53116 > localhost.6060: Flags [P.], seq 23:31, ack 946, win 10229, options [nop,nop,TS val 923860685 ecr 923845934], length 8
15:41:00.135212 IP localhost.53116 > localhost.6060: Flags [P.], seq 31:36, ack 946, win 10229, options [nop,nop,TS val 923860685 ecr 923845934], length 5
15:41:00.135304 IP localhost.6060 > localhost.53116: Flags [.], ack 36, win 512, options [nop,nop,TS val 923860685 ecr 923860685], length 0
15:41:00.135518 IP localhost.6060 > localhost.53116: Flags [P.], seq 946:959, ack 36, win 512, options [nop,nop,TS val 923860685 ecr 923860685], length 13
15:41:00.135727 IP localhost.53116 > localhost.6060: Flags [.], ack 959, win 10229, options [nop,nop,TS val 923860685 ecr 923860685], length 0
15:41:08.272231 IP localhost.6060 > localhost.53116: Flags [P.], seq 959:1883, ack 36, win 512, options [nop,nop,TS val 923868822 ecr 923860685], length 924
15:41:08.272259 IP localhost.53116 > localhost.6060: Flags [.], ack 1883, win 10229, options [nop,nop,TS val 923868822 ecr 923868822], length 0
15:41:08.888076 IP localhost.53116 > localhost.6060: Flags [P.], seq 36:44, ack 1883, win 10229, options [nop,nop,TS val 923869438 ecr 923868822], length 8
15:41:08.888102 IP localhost.53116 > localhost.6060: Flags [P.], seq 44:46, ack 1883, win 10229, options [nop,nop,TS val 923869438 ecr 923868822], length 2
15:41:08.888709 IP localhost.6060 > localhost.53116: Flags [.], ack 46, win 512, options [nop,nop,TS val 923869438 ecr 923869438], length 0
15:41:08.889001 IP localhost.6060 > localhost.53116: Flags [P.], seq 1883:1893, ack 46, win 512, options [nop,nop,TS val 923869439 ecr 923869438], length 10
15:41:08.889018 IP localhost.53116 > localhost.6060: Flags [.], ack 1893, win 10229, options [nop,nop,TS val 923869439 ecr 923869439], length 0
15:41:12.110451 IP localhost.60980 > localhost.6060: Flags [S], seq 1517977097, win 65495, options [mss 65495,sackOK,TS val 923872660 ecr 0,nop,wscale 7], length 0
15:41:12.110471 IP localhost.6060 > localhost.60980: Flags [S.], seq 2680385372, ack 1517977098, win 65483, options [mss 65495,sackOK,TS val 923872660 ecr 923872660,nop,wscale 7], length 0
15:41:12.110485 IP localhost.60980 > localhost.6060: Flags [.], ack 1, win 512, options [nop,nop,TS val 923872660 ecr 923872660], length 0
15:41:12.110601 IP localhost.60980 > localhost.6060: Flags [P.], seq 1:9, ack 1, win 512, options [nop,nop,TS val 923872660 ecr 923872660], length 8
15:41:12.110606 IP localhost.6060 > localhost.60980: Flags [.], ack 9, win 512, options [nop,nop,TS val 923872660 ecr 923872660], length 0
15:41:12.110613 IP localhost.60980 > localhost.6060: Flags [P.], seq 9:74, ack 1, win 512, options [nop,nop,TS val 923872660 ecr 923872660], length 65
15:41:12.110617 IP localhost.6060 > localhost.60980: Flags [.], ack 74, win 512, options [nop,nop,TS val 923872660 ecr 923872660], length 0
15:41:12.123283 IP localhost.6060 > localhost.60980: Flags [P.], seq 1:21, ack 74, win 512, options [nop,nop,TS val 923872673 ecr 923872660], length 20
15:41:12.123304 IP localhost.60980 > localhost.6060: Flags [.], ack 21, win 512, options [nop,nop,TS val 923872673 ecr 923872673], length 0
15:41:12.865509 IP localhost.60980 > localhost.6060: Flags [F.], seq 74, ack 21, win 512, options [nop,nop,TS val 923873415 ecr 923872673], length 0
15:41:12.905980 IP localhost.6060 > localhost.60980: Flags [.], ack 75, win 512, options [nop,nop,TS val 923873456 ecr 923873415], length 0
15:41:13.959439 IP localhost.6060 > localhost.60980: Flags [R.], seq 21, ack 75, win 512, options [nop,nop,TS val 923874509 ecr 923873415], length 0

**Comment by petroars** [comment]
somehow it uses different timezones, so it shows 1 hour difference. But it was done at the same time

**Comment by AndrewWestberg** [comment]
@petroars I believe what is happening is that your cncli is taking too long to query the database and gather the points to send to the node to start the find-intersect call for the chainsync miniprotocol. I'm going to adjust the code so it queries this before making the connection instead of after. 

The node has a default timeout of 5 seconds after the handshake completes. If the client doesn't send anything in that time, it gets dropped. 

In the meantime, if you want to test this theory, you can temporarily set 

```
"ProtocolIdleTimeout": 60,
```

in your config.json. This will see if my theory holds.

**Comment by petroars** [comment]
> @petroars I believe what is happening is that your cncli is taking too long to query the database and gather the points to send to the node to start the find-intersect call for the chainsync miniprotocol. I'm going to adjust the code so it queries this before making the connection instead of after.
> 
> The node has a default timeout of 5 seconds after the handshake completes. If the client doesn't send anything in that time, it gets dropped.
> 
> In the meantime, if you want to test this theory, you can temporarily set
> 
> ```
> "ProtocolIdleTimeout": 60,
> ```
> 
> in your config.json. This will see if my theory holds.

Yes! It works now! Thank you! Is it safe to run nodes and BP with that setting? "ProtocolIdleTimeout": 60 ?

**Comment by AndrewWestberg** [comment]
@petroars Please test alpha4.

**Comment by AndrewWestberg** [comment]
@petroars You can remove the ProtocolIdleTimeout setting. In alpha4, the db query has been improved to running fast so the node won't kick you off for timing out.

**Comment by petroars** [comment]
> @petroars You can remove the ProtocolIdleTimeout setting. In alpha4, the db query has been improved to running fast so the node won't kick you off for timing out.

Yes, Alpha5 works, thank you! I guess we can finally close this issue.

**Comment by rphair** [comment]
Thank you so much @AndrewWestberg for your excellent work in getting this great tool back into our workflow without any reservations.  I've tested the latest non-alpha release operationally among most of the scenarios above & that we reported up through https://github.com/cardano-community/cncli/issues/25#issuecomment-1650237680, and it stays working all around whatever happens to the node or the host networking environment. 🤩

**Comment by AndrewWestberg** [comment]
Thanks @rphair . It was difficult to figure out all and resolve all the issues. It felt good to finally close out all the cncli issues.
